{
  "schemaVersion": "1.0.0",
  "corpus_id": "benchmark-g3-holdout@1.0.0",
  "corpus_version": 1,
  "workItem": "G3-BEN-001",
  "seed": 2026,
  "runtime": "megis.benchmark@0.1.0",
  "timeout_ms": 5000,
  "cases": [
    {
      "case_id": "BEN-H-01",
      "bucket": "holdout",
      "severity_class": "defect",
      "title_zh": "最小壁厚不足（0.4 mm < 0.8 mm）",
      "reviewer": "MEGIS Builder（D6；holdout 先封存後施工）",
      "oracle": {
        "expected_detection": 1,
        "expected_max_severity": "error",
        "error_grade": true,
        "expected_maturity_max": "CONCEPT",
        "expect_false_release": false
      },
      "rule_checks": [
        {
          "rule_id": "CNC_MIN_WALL_001",
          "inputs": {
            "wall_thickness_mm": 0.4
          }
        }
      ]
    },
    {
      "case_id": "BEN-H-02",
      "bucket": "holdout",
      "severity_class": "defect",
      "title_zh": "孔深／徑比超標（4.8 > 3）",
      "reviewer": "MEGIS Builder（D6；holdout 先封存後施工）",
      "oracle": {
        "expected_detection": 1,
        "expected_max_severity": "error",
        "error_grade": true,
        "expected_maturity_max": "CONCEPT",
        "expect_false_release": false
      },
      "rule_checks": [
        {
          "rule_id": "CNC_HOLE_ASPECT_001",
          "inputs": {
            "hole_depth_mm": 12.0,
            "hole_diameter_mm": 2.5
          }
        }
      ]
    },
    {
      "case_id": "BEN-H-03",
      "bucket": "holdout",
      "severity_class": "defect",
      "title_zh": "兩元件體積重疊碰撞",
      "reviewer": "MEGIS Builder（D6；holdout 先封存後施工）",
      "oracle": {
        "expected_detection": 1,
        "expected_max_severity": "error",
        "error_grade": true,
        "expected_maturity_max": "CONCEPT",
        "expect_false_release": false
      },
      "validation_input": {
        "design_id": "holdout-collision-003",
        "components": [
          {
            "component_id": "a",
            "box": {
              "min": [0, 0, 0],
              "max": [10, 10, 10]
            }
          },
          {
            "component_id": "b",
            "box": {
              "min": [5, 5, 5],
              "max": [15, 15, 15]
            }
          }
        ]
      }
    },
    {
      "case_id": "BEN-H-04",
      "bucket": "holdout",
      "severity_class": "defect",
      "title_zh": "PCB 邊距不足（1.2 mm < 1.5 mm）",
      "reviewer": "MEGIS Builder（D6；holdout 先封存後施工）",
      "oracle": {
        "expected_detection": 1,
        "expected_max_severity": "error",
        "error_grade": true,
        "expected_maturity_max": "CONCEPT",
        "expect_false_release": false
      },
      "rule_checks": [
        {
          "rule_id": "PCB_EDGE_CLEAR_001",
          "inputs": {
            "pcb_edge_gap_mm": 1.2
          }
        }
      ]
    },
    {
      "case_id": "BEN-H-05",
      "bucket": "holdout",
      "severity_class": "defect",
      "title_zh": "USB-C 內縮開口不足（0.93 < 1.05）",
      "reviewer": "MEGIS Builder（D6；holdout 先封存後施工）",
      "oracle": {
        "expected_detection": 1,
        "expected_max_severity": "error",
        "error_grade": true,
        "expected_maturity_max": "CONCEPT",
        "expect_false_release": false
      },
      "rule_checks": [
        {
          "rule_id": "CON_USBC_RECESS_001",
          "inputs": {
            "usbc_recess_opening_mm": 9.0,
            "usbc_plug_overmold_mm": 9.7
          }
        }
      ]
    },
    {
      "case_id": "BEN-H-06",
      "bucket": "holdout",
      "severity_class": "defect",
      "title_zh": "boss 剩餘壁厚不足（1.2 mm < 1.5 mm）",
      "reviewer": "MEGIS Builder（D6；holdout 先封存後施工）",
      "oracle": {
        "expected_detection": 1,
        "expected_max_severity": "error",
        "error_grade": true,
        "expected_maturity_max": "CONCEPT",
        "expect_false_release": false
      },
      "rule_checks": [
        {
          "rule_id": "FAS_BOSS_WALL_001",
          "inputs": {
            "boss_wall_thickness_mm": 1.2
          }
        }
      ]
    },
    {
      "case_id": "BEN-H-07",
      "bucket": "holdout",
      "severity_class": "defect",
      "title_zh": "孔邊至零件邊距離不足（warning）",
      "reviewer": "MEGIS Builder（D6；holdout 先封存後施工）",
      "oracle": {
        "expected_detection": 1,
        "expected_max_severity": "warning",
        "error_grade": false,
        "expected_maturity_max": "PROTOTYPE",
        "expect_false_release": false
      },
      "rule_checks": [
        {
          "rule_id": "CNC_EDGE_DIST_001",
          "inputs": {
            "hole_edge_distance_mm": 1.7
          }
        }
      ],
      "maturity_input": {
        "requirements_schema_valid": true,
        "ir_schema_valid": true,
        "ir_referential_integrity_ok": true,
        "layout_collision_no_error": true,
        "geometry_kernel_valid": true,
        "rule_packs_executed": true,
        "warnings_dispositioned": true,
        "fingerprint_reproducible": true,
        "drawing_qa_recorded": true,
        "capabilities_in_envelope": true,
        "named_engineer_available": true
      }
    },
    {
      "case_id": "BEN-H-08",
      "bucket": "holdout",
      "severity_class": "clean",
      "title_zh": "無缺陷完整設計：幾何、規則與成熟度全綠",
      "reviewer": "MEGIS Builder（D6；holdout 先封存後施工）",
      "oracle": {
        "expected_detection": 0,
        "expected_max_severity": "pass",
        "error_grade": false,
        "expected_maturity_max": "PROTOTYPE",
        "expect_false_release": false
      },
      "validation_input": {
        "design_id": "holdout-clean-008",
        "components": [
          {
            "component_id": "base",
            "box": {
              "min": [0, 0, 0],
              "max": [60, 40, 4]
            }
          },
          {
            "component_id": "pcb",
            "box": {
              "min": [2, 2, 5],
              "max": [58, 38, 6.6]
            }
          },
          {
            "component_id": "cover",
            "box": {
              "min": [0, 0, 7],
              "max": [60, 40, 9]
            }
          }
        ],
        "clearances": [
          {
            "first_id": "base",
            "second_id": "pcb",
            "min_gap_mm": 0.9,
            "rule_id": "PCB_STANDOFF_001"
          },
          {
            "first_id": "pcb",
            "second_id": "cover",
            "min_gap_mm": 0.4,
            "rule_id": "PCB_TOP_CLEAR_001"
          }
        ]
      },
      "rule_checks": [
        {
          "rule_id": "CNC_MIN_WALL_001",
          "inputs": {
            "wall_thickness_mm": 1.2
          }
        },
        {
          "rule_id": "PCB_EDGE_CLEAR_001",
          "inputs": {
            "pcb_edge_gap_mm": 2.5
          }
        },
        {
          "rule_id": "ASM_COLLISION_001",
          "inputs": {
            "collision_count": 0
          }
        }
      ],
      "maturity_input": {
        "requirements_schema_valid": true,
        "ir_schema_valid": true,
        "ir_referential_integrity_ok": true,
        "layout_collision_no_error": true,
        "geometry_kernel_valid": true,
        "rule_packs_executed": true,
        "warnings_dispositioned": true,
        "fingerprint_reproducible": true,
        "drawing_qa_recorded": true,
        "capabilities_in_envelope": true,
        "named_engineer_available": true
      }
    },
    {
      "case_id": "BEN-H-09",
      "bucket": "holdout",
      "severity_class": "clean",
      "title_zh": "餘隙恰等於下限（邊界含入，不算 violation）",
      "reviewer": "MEGIS Builder（D6；holdout 先封存後施工）",
      "oracle": {
        "expected_detection": 0,
        "expected_max_severity": "pass",
        "error_grade": false,
        "expected_maturity_max": "PROTOTYPE",
        "expect_false_release": false
      },
      "validation_input": {
        "design_id": "holdout-clearance-boundary-009",
        "components": [
          {
            "component_id": "base",
            "box": {
              "min": [0, 0, 0],
              "max": [10, 10, 10]
            }
          },
          {
            "component_id": "top",
            "box": {
              "min": [0, 0, 14],
              "max": [10, 10, 20]
            }
          }
        ],
        "clearances": [
          {
            "first_id": "base",
            "second_id": "top",
            "min_gap_mm": 4
          }
        ]
      },
      "maturity_input": {
        "requirements_schema_valid": true,
        "ir_schema_valid": true,
        "ir_referential_integrity_ok": true,
        "layout_collision_no_error": true,
        "geometry_kernel_valid": true,
        "rule_packs_executed": true,
        "warnings_dispositioned": true,
        "fingerprint_reproducible": true,
        "drawing_qa_recorded": true,
        "capabilities_in_envelope": true,
        "named_engineer_available": true
      }
    },
    {
      "case_id": "BEN-H-10",
      "bucket": "holdout",
      "severity_class": "clean",
      "title_zh": "面貼合不算碰撞（regression 防止回歸）",
      "reviewer": "MEGIS Builder（D6；holdout 先封存後施工）",
      "oracle": {
        "expected_detection": 0,
        "expected_max_severity": "pass",
        "error_grade": false,
        "expected_maturity_max": "PROTOTYPE",
        "expect_false_release": false
      },
      "validation_input": {
        "design_id": "holdout-touching-010",
        "components": [
          {
            "component_id": "a",
            "box": {
              "min": [0, 0, 0],
              "max": [10, 10, 10]
            }
          },
          {
            "component_id": "b",
            "box": {
              "min": [10, 0, 0],
              "max": [20, 10, 10]
            }
          }
        ]
      },
      "maturity_input": {
        "requirements_schema_valid": true,
        "ir_schema_valid": true,
        "ir_referential_integrity_ok": true,
        "layout_collision_no_error": true,
        "geometry_kernel_valid": true,
        "rule_packs_executed": true,